{
  "reportFormat": "CTRF",
  "specVersion": "0.0.0",
  "generatedBy": "ctrf-converter v1.0.0",
  "timestamp": "2026-06-11T19:33:42.210Z",
  "results": {
    "tool": {
      "name": "ctrf-converter",
      "version": "1.0.0"
    },
    "summary": {
      "tests": 3,
      "passed": 2,
      "failed": 1,
      "skipped": 0,
      "pending": 0,
      "other": 0,
      "start": 1781206422210,
      "stop": 1781206422247,
      "suites": 1,
      "duration": 37
    },
    "tests": [
      {
        "name": "Create patient",
        "status": "passed",
        "duration": 16,
        "suite": [
          "PatientRegistration.Patient Registration (Example)"
        ],
        "stdout": [
          "@scenario.begin\n\n  @tc:62\n  Scenario: Create patient\n    When I create a patient with name \"John Doe\" on the host ... passed in 0.005s\n    Then the patient \"John Doe\" should also be created in the application. ... passed in 0.011s\n\n@scenario.end\n--------------------------------------------------------------------------------"
        ]
      },
      {
        "name": "Close patient",
        "status": "passed",
        "duration": 15,
        "suite": [
          "PatientRegistration.Patient Registration (Example)"
        ],
        "stdout": [
          "@scenario.begin\n\n  @tc:63\n  Scenario: Close patient\n    Given a patient is opened in the application ... passed in 0.005s\n    When I close the patient on the host ... passed in 0.005s\n    Then the patient should also be closed in the application. ... passed in 0.005s\n\n@scenario.end\n--------------------------------------------------------------------------------"
        ]
      },
      {
        "name": "Edit patient",
        "status": "passed",
        "duration": 6,
        "suite": [
          "PatientRegistration.Patient Registration (Example)"
        ],
        "message": "edit() missing 2 required positional arguments: 'birth_date' and 'sex'",
        "trace": "Failing step: When I change the patient name to \"John Doe\" on the host ... failed in 0.001s\nLocation: tests/features/PatientRegistration.feature:20\nTraceback (most recent call last):\n  File \"D:\\dev\\bdd_demo_behave\\.venv\\lib\\site-packages\\behave\\model.py\", line 1329, in run\n    match.run(runner.context)\n  File \"D:\\dev\\bdd_demo_behave\\.venv\\lib\\site-packages\\behave\\matchers.py\", line 98, in run\n    self.func(context, *args, **kwargs)\n  File \"tests\\features\\steps\\step_patient_registration.py\", line 33, in step_impl\n    context.patient.edit(first_name=\"John\", last_name=\"Doe\")\nTypeError: edit() missing 2 required positional arguments: 'birth_date' and 'sex'",
        "stdout": [
          "@scenario.begin\n  Scenario: Edit patient\n    Given a patient is opened in the application ... passed in 0.005s\n    When I change the patient name to \"John Doe\" on the host ... failed in 0.001s\n    Then the patient name should also be changed to \"John Doe\" in the application. ... skipped in 0.000s\n\n@scenario.end\n--------------------------------------------------------------------------------"
        ],
        "stderr": [
          "Failing step: When I change the patient name to \"John Doe\" on the host ... failed in 0.001s\nLocation: tests/features/PatientRegistration.feature:20\nTraceback (most recent call last):\n  File \"D:\\dev\\bdd_demo_behave\\.venv\\lib\\site-packages\\behave\\model.py\", line 1329, in run\n    match.run(runner.context)\n  File \"D:\\dev\\bdd_demo_behave\\.venv\\lib\\site-packages\\behave\\matchers.py\", line 98, in run\n    self.func(context, *args, **kwargs)\n  File \"tests\\features\\steps\\step_patient_registration.py\", line 33, in step_impl\n    context.patient.edit(first_name=\"John\", last_name=\"Doe\")\nTypeError: edit() missing 2 required positional arguments: 'birth_date' and 'sex'"
        ]
      }
    ]
  }
}